,1,2,3,4,5
bachBWV889Fg,"Daniel Barenboim - Bach, JS  Well-Tempered Clavier Book 2 [48 Preludes & Fugues Book 2]",Reza Touserkani - J S Bach The Well-Tempered Clavier Book 2,"Jouni Somero - Bach The Well-Tempered Clavier, Book 2, BWV 870-893","Gerlinde Otto - Bach The Well-Tempered Clavier, Book 2",Anna Larsen - Bach Well-Tempered Clavier II
mozartK282Mvt2,András Schiff - Mozart The Piano Sonatas (5 CDs),Mitsuko Uchida - Mozart The Piano Sonatas (5 CDs),Maria João Pires - Mozart Piano Sonatas,"Kraus, Lili - Mozart Piano Works","Alfred Brendel - Mozart Piano Sonatas Nos3, 4 & 18"
chopinOp24No4,Vladimir Ashkenazy - Decca 448 086-2,Evgeny  - RCA Victor Red Seal 09026 62542 2,Nikita Magaloff - Phillips 426 817/29-2 - Chopin: The Complete Piano Music,"Arthur Rubinstein - BMG 09026-63050-2 - The Rubinstein Collection, vol. 50: 51 Chopin Mazurkas",Idil Biret - Naxos 8.550359 -Chopin: Mazurkas (Complete)
gibbonsSilverSwan1612,Timothy Roberts - Gibbons Consort And Keyboard Music  Songs And Anthems,Phantasm - Gibbons Consorts for Viols,Luna E Cinque - The Renaissance Project,"James Tinsley, The Niagara Brass Ensemble - Bach Baroque Brass","Concordia - Orlando Gibbons Go From My Window - Music for Viols, Vol 2"
beethovenOp2No1Mvt3,"Mario Papadopoulas - Beethoven Piano Sonatas Nos 1, 2 & 3","Maria Grinberg - Beethoven Piano Sonatas Nos 1, 2 & 3","John OConor - Beethoven Piano Sonatas Volume 4, Op 2, Nos 1, 2, And 9","Carlo Lombardi - Beethoven, Busoni, Rubinstein Carlo Lombardi Plays Beethoven Piano M","Alfred Brendel - Beethoven Piano Sonatas, Op2 Nos1-3"